{
  "schema_version": "v1",
  "spaces": [
    { "index": 0, "kind": "GO", "name": "Go", "group": null, "price": null },
    { "index": 1, "kind": "PROPERTY", "name": "Mediterranean Avenue", "group": "BROWN", "price": 60 },
    { "index": 2, "kind": "COMMUNITY_CHEST", "name": "Community Chest", "group": null, "price": null },
    { "index": 3, "kind": "PROPERTY", "name": "Baltic Avenue", "group": "BROWN", "price": 60 },
    { "index": 4, "kind": "TAX", "name": "Income Tax", "group": null, "price": null },
    { "index": 5, "kind": "RAILROAD", "name": "Reading Railroad", "group": "RAILROAD", "price": 200 },
    { "index": 6, "kind": "PROPERTY", "name": "Oriental Avenue", "group": "LIGHT_BLUE", "price": 100 },
    { "index": 7, "kind": "CHANCE", "name": "Chance", "group": null, "price": null },
    { "index": 8, "kind": "PROPERTY", "name": "Vermont Avenue", "group": "LIGHT_BLUE", "price": 100 },
    { "index": 9, "kind": "PROPERTY", "name": "Connecticut Avenue", "group": "LIGHT_BLUE", "price": 120 },
    { "index": 10, "kind": "JAIL", "name": "Jail", "group": null, "price": null },
    { "index": 11, "kind": "PROPERTY", "name": "St. Charles Place", "group": "PINK", "price": 140 },
    { "index": 12, "kind": "UTILITY", "name": "Electric Company", "group": "UTILITY", "price": 150 },
    { "index": 13, "kind": "PROPERTY", "name": "States Avenue", "group": "PINK", "price": 140 },
    { "index": 14, "kind": "PROPERTY", "name": "Virginia Avenue", "group": "PINK", "price": 160 },
    { "index": 15, "kind": "RAILROAD", "name": "Pennsylvania Railroad", "group": "RAILROAD", "price": 200 },
    { "index": 16, "kind": "PROPERTY", "name": "St. James Place", "group": "ORANGE", "price": 180 },
    { "index": 17, "kind": "COMMUNITY_CHEST", "name": "Community Chest", "group": null, "price": null },
    { "index": 18, "kind": "PROPERTY", "name": "Tennessee Avenue", "group": "ORANGE", "price": 180 },
    { "index": 19, "kind": "PROPERTY", "name": "New York Avenue", "group": "ORANGE", "price": 200 },
    { "index": 20, "kind": "FREE_PARKING", "name": "Free Parking", "group": null, "price": null },
    { "index": 21, "kind": "PROPERTY", "name": "Kentucky Avenue", "group": "RED", "price": 220 },
    { "index": 22, "kind": "CHANCE", "name": "Chance", "group": null, "price": null },
    { "index": 23, "kind": "PROPERTY", "name": "Indiana Avenue", "group": "RED", "price": 220 },
    { "index": 24, "kind": "PROPERTY", "name": "Illinois Avenue", "group": "RED", "price": 240 },
    { "index": 25, "kind": "RAILROAD", "name": "B. & O. Railroad", "group": "RAILROAD", "price": 200 },
    { "index": 26, "kind": "PROPERTY", "name": "Atlantic Avenue", "group": "YELLOW", "price": 260 },
    { "index": 27, "kind": "PROPERTY", "name": "Ventnor Avenue", "group": "YELLOW", "price": 260 },
    { "index": 28, "kind": "UTILITY", "name": "Water Works", "group": "UTILITY", "price": 150 },
    { "index": 29, "kind": "PROPERTY", "name": "Marvin Gardens", "group": "YELLOW", "price": 280 },
    { "index": 30, "kind": "GO_TO_JAIL", "name": "Go To Jail", "group": null, "price": null },
    { "index": 31, "kind": "PROPERTY", "name": "Pacific Avenue", "group": "GREEN", "price": 300 },
    { "index": 32, "kind": "PROPERTY", "name": "North Carolina Avenue", "group": "GREEN", "price": 300 },
    { "index": 33, "kind": "COMMUNITY_CHEST", "name": "Community Chest", "group": null, "price": null },
    { "index": 34, "kind": "PROPERTY", "name": "Pennsylvania Avenue", "group": "GREEN", "price": 320 },
    { "index": 35, "kind": "RAILROAD", "name": "Short Line", "group": "RAILROAD", "price": 200 },
    { "index": 36, "kind": "CHANCE", "name": "Chance", "group": null, "price": null },
    { "index": 37, "kind": "PROPERTY", "name": "Park Place", "group": "DARK_BLUE", "price": 350 },
    { "index": 38, "kind": "TAX", "name": "Luxury Tax", "group": null, "price": null },
    { "index": 39, "kind": "PROPERTY", "name": "Boardwalk", "group": "DARK_BLUE", "price": 400 }
  ],
  "property_rent_tables": {
    "1": [2, 10, 30, 90, 160, 250],
    "3": [4, 20, 60, 180, 320, 450],
    "6": [6, 30, 90, 270, 400, 550],
    "8": [6, 30, 90, 270, 400, 550],
    "9": [8, 40, 100, 300, 450, 600],
    "11": [10, 50, 150, 450, 625, 750],
    "13": [10, 50, 150, 450, 625, 750],
    "14": [12, 60, 180, 500, 700, 900],
    "16": [14, 70, 200, 550, 750, 950],
    "18": [14, 70, 200, 550, 750, 950],
    "19": [16, 80, 220, 600, 800, 1000],
    "21": [18, 90, 250, 700, 875, 1050],
    "23": [18, 90, 250, 700, 875, 1050],
    "24": [20, 100, 300, 750, 925, 1100],
    "26": [22, 110, 330, 800, 975, 1150],
    "27": [22, 110, 330, 800, 975, 1150],
    "29": [24, 120, 360, 850, 1025, 1200],
    "31": [26, 130, 390, 900, 1100, 1275],
    "32": [26, 130, 390, 900, 1100, 1275],
    "34": [28, 150, 450, 1000, 1200, 1400],
    "37": [35, 175, 500, 1100, 1300, 1500],
    "39": [50, 200, 600, 1400, 1700, 2000]
  },
  "railroad_rents": [25, 50, 100, 200],
  "utility_rent_multiplier": { "1": 4, "2": 10 },
  "tax_amounts": { "4": 200, "38": 100 }
}

